7:31:15.349833 IP 10.0.0.102.2049 > 10.5.6.201.1849007595: reply ok 112
17:31:15.351562 IP 10.0.0.102.2049 > 10.5.6.201.1865784811: reply ok 112
17:31:15.351566 IP 10.0.0.102.2049 > 10.5.6.201.1865784811: reply ok 112
17:31:15.358436 IP 10.0.0.102.2049 > 10.5.6.201.1882562027: reply ok 112
17:31:15.358441 IP 10.0.0.102.2049 > 10.5.6.201.1882562027: reply ok 112
17:31:15.359985 IP 10.0.0.102.2049 > 10.5.6.201.1899339243: reply ok 112
17:31:15.360034 IP 10.0.0.102.2049 > 10.5.6.201.1899339243: reply ok 112
17:31:18.433202 IP 10.0.0.102.2049 > 10.5.6.245.3640143023: reply ok 112
17:31:18.433454 IP 10.0.0.102.2049 > 10.5.6.245.3640143023: reply ok 112
17:31:21.470918 IP 10.0.0.102.2049 > 10.5.5.152.3804065548: reply ok 120
17:31:21.470987 IP 10.0.0.102.2049 > 10.5.5.152.3804065548: reply ok 120
17:31:21.471427 IP 10.0.0.102.2049 > 10.5.5.152.3820842764: reply ok 120
17:31:21.471440 IP 10.0.0.102.2049 > 10.5.5.152.3820842764: reply ok 120
17:31:22.743712 IP 10.0.0.102.2049 > 10.5.6.251.353199702: reply ok 112
17:31:22.743776 IP 10.0.0.102.2049 > 10.5.6.251.353199702: reply ok 112
17:31:25.347274 IP 10.0.0.102.2049 > 10.5.14.5.2789138114: reply ok 112
17:31:25.348319 IP 10.0.0.102.2049 > 10.5.14.5.2789138114: reply ok 112
17:31:25.350394 IP 10.0.0.102.2049 > 10.5.14.5.2805915330: reply ok 112
17:31:25.350492 IP 10.0.0.102.2049 > 10.5.14.5.2805915330: reply ok 112
17:31:25.351000 IP 10.0.0.102.2049 > 10.5.14.5.2822692546: reply ok 120
17:31:25.351124 IP 10.0.0.102.2049 > 10.5.14.5.2822692546: reply ok 120
17:31:25.352030 IP 10.0.0.102.2049 > 10.5.14.5.2839469762: reply ok 120
17:31:25.352086 IP 10.0.0.102.2049 > 10.5.14.5.2839469762: reply ok 120
17:31:25.352334 IP 10.0.0.102.2049 > 10.5.14.5.2856246978: reply ok 120
17:31:25.352496 IP 10.0.0.102.2049 > 10.5.14.5.2856246978: reply ok 120
17:31:25.352709 IP 10.0.0.102.2049 > 10.5.14.5.2873024194: reply ok 112
17:31:25.352804 IP 10.0.0.102.2049 > 10.5.14.5.2873024194: reply ok 112
17:31:25.353036 IP 10.0.0.102.2049 > 10.5.14.5.2889801410: reply ok 112
17:31:25.353094 IP 10.0.0.102.2049 > 10.5.14.5.2889801410: reply ok 112
17:31:25.353722 IP 10.0.0.102.2049 > 10.5.14.5.2906578626: reply ok 120
17:31:25.353776 IP 10.0.0.102.2049 > 10.5.14.5.2906578626: reply ok 120
17:31:25.354117 IP 10.0.0.102.2049 > 10.5.14.5.2923355842: reply ok 112
17:31:25.354151 IP 10.0.0.102.2049 > 10.5.14.5.2923355842: reply ok 112
17:31:25.354510 IP 10.0.0.102.2049 > 10.5.14.5.2940133058: reply ok 144
17:31:25.354553 IP 10.0.0.102.2049 > 10.5.14.5.2940133058: reply ok 144
17:31:25.677678 IP 10.0.0.102.2049 > 10.5.6.251.369976918: reply ok 112
17:31:25.677711 IP 10.0.0.102.2049 > 10.5.6.251.369976918: reply ok 112
